{
  "schema_version": 1,
  "refreshed_at": "2026-10-26T11:12:49.599Z",
  "repositories": {
    "CorsixTH/CorsixTH": {
      "repository": "CorsixTH/CorsixTH",
      "url": "https://github.com/CorsixTH/CorsixTH",
      "fetched_at": "2026-10-26T11:12:23.237Z",
      "stars": 4623,
      "forks": 441,
      "archived": false,
      "default_branch": "master",
      "pushed_at": "2026-10-25T23:23:01Z",
      "releases": {
        "state": "stable",
        "latest_stable": {
          "tag": "v0.70.1",
          "url": "https://github.com/CorsixTH/CorsixTH/releases/tag/v0.70.1",
          "published_at": "2026-08-28T13:33:08Z"
        },
        "latest_prerelease": {
          "tag": "v0.70.0-rc2",
          "url": "https://github.com/CorsixTH/CorsixTH/releases/tag/v0.70.0-rc2",
          "published_at": "2026-06-28T19:16:08Z"
        }
      },
      "cache": {
        "repository_etag": "W/\"f18a60db44485c1874644945e874c98597a189b618b0a876fc4ae94980e05f3e\"",
        "releases_etag": "W/\"531daf2732cceda85a25845e9b79c886db94e659d5ed74aa84b15adc917aa12b\""
      },
      "source": {
        "repository_api": "https://api.github.com/repos/CorsixTH/CorsixTH",
        "releases_api": "https://api.github.com/repos/CorsixTH/CorsixTH/releases?per_page=20"
      }
    },
    "FreeCol/freecol": {
      "repository": "FreeCol/freecol",
      "url": "https://github.com/FreeCol/freecol",
      "fetched_at": "2026-10-26T11:12:24.640Z",
      "stars": 718,
      "forks": 212,
      "archived": false,
      "default_branch": "sf-auto-merge",
      "pushed_at": "2026-10-22T12:04:40Z",
      "releases": {
        "state": "stable",
        "latest_stable": {
          "tag": "v1.2.0",
          "url": "https://github.com/FreeCol/freecol/releases/tag/v1.2.0",
          "published_at": "2024-07-23T19:57:41Z"
        },
        "latest_prerelease": {
          "tag": "latest",
          "url": "https://github.com/FreeCol/freecol/releases/tag/latest",
          "published_at": "2026-10-22T12:04:43Z"
        }
      },
      "cache": {
        "repository_etag": "W/\"6539e238bfce143022b9e13d70832c31c0bab18eb08b265250a3504d6ae37dac\"",
        "releases_etag": "W/\"916b93c12412f19baae5229fc86dc6197008d55959dcef3efff3936d966578d0\""
      },
      "source": {
        "repository_api": "https://api.github.com/repos/FreeCol/freecol",
        "releases_api": "https://api.github.com/repos/FreeCol/freecol/releases?per_page=20"
      }
    },
    "HarbourMasters/2ship2harkinian": {
      "repository": "HarbourMasters/2ship2harkinian",
      "url": "https://github.com/2ship2harkinian/2ship2harkinian",
      "fetched_at": "2026-10-26T11:12:25.776Z",
      "stars": 2381,
      "forks": 288,
      "archived": false,
      "default_branch": "develop",
      "pushed_at": "2026-10-24T14:42:15Z",
      "releases": {
        "state": "stable",
        "latest_stable": {
          "tag": "5.0.1",
          "url": "https://github.com/2ship2harkinian/2ship2harkinian/releases/tag/5.0.1",
          "published_at": "2026-08-25T17:54:43Z"
        },
        "latest_prerelease": null
      },
      "cache": {
        "repository_etag": "W/\"b823bab4b3849e98e0630292ac9ea2e8b1e2c1d9d8b7e375892af4105830b64a\"",
        "releases_etag": "W/\"7fe82e125e7abec8ba95b6f4b6afa199bf6978eaf6d24bfd8c422323e0314ea9\""
      },
      "source": {
        "repository_api": "https://api.github.com/repos/HarbourMasters/2ship2harkinian",
        "releases_api": "https://api.github.com/repos/HarbourMasters/2ship2harkinian/releases?per_page=20"
      }
    },
    "HarbourMasters/Shipwright": {
      "repository": "HarbourMasters/Shipwright",
      "url": "https://github.com/HarbourMasters/Shipwright",
      "fetched_at": "2026-10-26T11:12:26.445Z",
      "stars": 5762,
      "forks": 954,
      "archived": false,
      "default_branch": "develop",
      "pushed_at": "2026-10-24T13:40:22Z",
      "releases": {
        "state": "stable",
        "latest_stable": {
          "tag": "9.3.1",
          "url": "https://github.com/HarbourMasters/Shipwright/releases/tag/9.3.1",
          "published_at": "2026-10-18T21:06:27Z"
        },
        "latest_prerelease": null
      },
      "cache": {
        "repository_etag": "W/\"6b54566aef955dd20158e08f17cb9bdcff27a4ac799370abbab7ad748bce2a65\"",
        "releases_etag": "W/\"9802e39605598b38faed46513b0a69bf710c8e69add02afad5a8a5285bc35536\""
      },
      "source": {
        "repository_api": "https://api.github.com/repos/HarbourMasters/Shipwright",
        "releases_api": "https://api.github.com/repos/HarbourMasters/Shipwright/releases?per_page=20"
      }
    },
    "HarbourMasters/Starship": {
      "repository": "HarbourMasters/Starship",
      "url": "https://github.com/HarbourMasters/Starship",
      "fetched_at": "2026-10-26T11:12:27.012Z",
      "stars": 2121,
      "forks": 147,
      "archived": false,
      "default_branch": "main",
      "pushed_at": "2026-09-15T21:17:12Z",
      "releases": {
        "state": "stable",
        "latest_stable": {
          "tag": "v2.0.0",
          "url": "https://github.com/HarbourMasters/Starship/releases/tag/v2.0.0",
          "published_at": "2025-05-25T03:43:32Z"
        },
        "latest_prerelease": null
      },
      "cache": {
        "repository_etag": "W/\"30adf298dd9ab3034dfc434e7f00b3ad5c944b147cc80c248e40fb2be8da7b18\"",
        "releases_etag": "W/\"5d81828203d35819d2299c7512fd26a093cc9015db8f3e8b96eb6a0934c6f31f\""
      },
      "source": {
        "repository_api": "https://api.github.com/repos/HarbourMasters/Starship",
        "releases_api": "https://api.github.com/repos/HarbourMasters/Starship/releases?per_page=20"
      }
    },
    "OpenLoco/OpenLoco": {
      "repository": "OpenLoco/OpenLoco",
      "url": "https://github.com/OpenLoco/OpenLoco",
      "fetched_at": "2026-10-26T11:12:28.482Z",
      "stars": 1955,
      "forks": 224,
      "archived": false,
      "default_branch": "master",
      "pushed_at": "2026-10-14T22:04:07Z",
      "releases": {
        "state": "stable",
        "latest_stable": {
          "tag": "v26.09",
          "url": "https://github.com/OpenLoco/OpenLoco/releases/tag/v26.09",
          "published_at": "2026-09-18T19:13:09Z"
        },
        "latest_prerelease": null
      },
      "cache": {
        "repository_etag": "W/\"01d546c50f28bb2b58e751d9d56bdef9c6c966cf5d7367fdb8fd7fae316515d0\"",
        "releases_etag": "W/\"d69a4098b814f45ed7448fa28d2e79e197d1c15cc44606663dbf777e86066136\""
      },
      "source": {
        "repository_api": "https://api.github.com/repos/OpenLoco/OpenLoco",
        "releases_api": "https://api.github.com/repos/OpenLoco/OpenLoco/releases?per_page=20"
      }
    },
    "OpenRA/OpenRA": {
      "repository": "OpenRA/OpenRA",
      "url": "https://github.com/OpenRA/OpenRA",
      "fetched_at": "2026-10-26T11:12:29.264Z",
      "stars": 17658,
      "forks": 3093,
      "archived": false,
      "default_branch": "bleed",
      "pushed_at": "2026-10-25T18:34:34Z",
      "releases": {
        "state": "stable",
        "latest_stable": {
          "tag": "release-20250330",
          "url": "https://github.com/OpenRA/OpenRA/releases/tag/release-20250330",
          "published_at": "2025-03-30T17:36:43Z"
        },
        "latest_prerelease": {
          "tag": "playtest-20261026",
          "url": "https://github.com/OpenRA/OpenRA/releases/tag/playtest-20261026",
          "published_at": "2026-10-25T18:47:59Z"
        }
      },
      "cache": {
        "repository_etag": "W/\"4f171b878fe750bb79b0916e561f8b99334168653eea11f338d01101e39db3b2\"",
        "releases_etag": "W/\"3c8ea03e2cf34ac17925fb1435120dc13542d88c8971c36e872b652c624e80c1\""
      },
      "source": {
        "repository_api": "https://api.github.com/repos/OpenRA/OpenRA",
        "releases_api": "https://api.github.com/repos/OpenRA/OpenRA/releases?per_page=20"
      }
    },
    "OpenRCT2/OpenRCT2": {
      "repository": "OpenRCT2/OpenRCT2",
      "url": "https://github.com/OpenRCT2/OpenRCT2",
      "fetched_at": "2026-10-26T11:12:30.067Z",
      "stars": 16501,
      "forks": 1958,
      "archived": false,
      "default_branch": "develop",
      "pushed_at": "2026-10-26T00:01:24Z",
      "releases": {
        "state": "stable",
        "latest_stable": {
          "tag": "v0.5.6",
          "url": "https://github.com/OpenRCT2/OpenRCT2/releases/tag/v0.5.6",
          "published_at": "2026-10-10T12:32:52Z"
        },
        "latest_prerelease": null
      },
      "cache": {
        "repository_etag": "W/\"6d6fdd39a71a61213e3edd49317a4b374a15196b51d076da3810f91405ca696b\"",
        "releases_etag": "W/\"8f2ab889db69962de5934fe7d18caac8c59d75bef0cd89914e281107c3d18359\""
      },
      "source": {
        "repository_api": "https://api.github.com/repos/OpenRCT2/OpenRCT2",
        "releases_api": "https://api.github.com/repos/OpenRCT2/OpenRCT2/releases?per_page=20"
      }
    },
    "OpenTTD/OpenTTD": {
      "repository": "OpenTTD/OpenTTD",
      "url": "https://github.com/OpenTTD/OpenTTD",
      "fetched_at": "2026-10-26T11:12:30.762Z",
      "stars": 8427,
      "forks": 1319,
      "archived": false,
      "default_branch": "master",
      "pushed_at": "2026-10-25T10:48:31Z",
      "releases": {
        "state": "stable",
        "latest_stable": {
          "tag": "15.3",
          "url": "https://github.com/OpenTTD/OpenTTD/releases/tag/15.3",
          "published_at": "2026-04-04T19:56:48Z"
        },
        "latest_prerelease": {
          "tag": "16.0-beta5",
          "url": "https://github.com/OpenTTD/OpenTTD/releases/tag/16.0-beta5",
          "published_at": "2026-10-24T22:36:25Z"
        }
      },
      "cache": {
        "repository_etag": "W/\"49f17670c031f31128d494c9deb31cc650746f90e1e2f5ca5f138137787af447\"",
        "releases_etag": "W/\"ab5709a8d38ae66540ad62598577c17781ecb7837e7c2b719cd20d420f504ff5\""
      },
      "source": {
        "repository_api": "https://api.github.com/repos/OpenTTD/OpenTTD",